id,user,one,two,three,four,five,six,seven,eight,nine,ten,created_at
テスト太郎,朝倉海,石渡伸太郎,伊藤盛一郎,井上直樹,魚井フルスイング,扇久保博正,加藤ケンジ,金原正徳,金太郎,倉本一真,2021-01-30 09:07:58.537446+00:00
take,朝倉海,パトリック・ミックス,井上直樹,扇久保博正,元谷友貴,ビクター・ヘンリー,石渡伸太郎,佐々木憂流迦,瀧澤謙太,神龍誠,2021-01-31 09:31:09.235461+00:00
ページテスト,渡部修斗,山本アーセン,元谷友貴,ビクター・ヘンリー,パトリック・ミックス,トレント・ガーダム,瀧澤謙太,神龍誠,佐々木憂流迦,倉本一真,2021-01-31 14:41:51.450382+00:00
id,user,one,two,three,four,five,six,seven,eight,nine,ten,created_at
テスト太郎,青井人,朝倉未来,芦田崇宏,ヴガール・ケラモフ,カイル・アグォン,クレベル・コイケ,斎藤裕,ジョン・マカパ,白川陸斗,ダリオン・コールドウェル,2021-01-30 09:34:14.641980+00:00
take,ダリオン・コールドウェル,朝倉未来,クレベル・コイケ,摩嶋一整,ジョン・マカパ,弥益ドミネーター聡志,ヴガール・ケラモフ,芦田崇宏,萩原京平,カイル・アグォン,2021-01-31 09:34:21.360283+00:00
